,date_time,city_area,state,country,ufo_shape,encounter_length,described_encounter_length,description,date_documented,latitude,longitude
45813,2013-05-05 00:43:00,regina (canada),sk,Canada,triangle,240.0,4 minutes,Black soft triangular shaped ufo&#44 three white lights near each tip seen slowly moving in general southward heading over Regina Sk&#44 Can.,5/15/2013,50.45,-104.616667
68524,1997-08-02 22:50:00,rocklin,ca,USA,other,10.0,10 seconds,One object was obviously pursuing another at very high altitude,9/28/2002,38.7908333,-121.2347222
62594,2013-07-04 17:00:00,bremerton,wa,USA,circle,60.0,1 minute,1 red orange round object observed on 4 July 2013 from Bremerton Washington approx. 17:00l,7/14/2013,47.5675,-122.6313889
22276,2006-01-24 23:15:00,oroville,ca,USA,teardrop,45.0,45 seconds,Object seen in Kelly Ridge,2/14/2006,39.5138889,-121.5552778
15433,2011-01-16 19:10:00,ridgefield,ct,USA,light,60.0,1 minute,Intensely flashing light stationary at first for 30 or 40 seconds then began to move south/west at a steady pace then blinked out.,1/31/2011,41.2813889,-73.4986111
30978,2012-03-12 21:30:00,lawton,ok,USA,teardrop,120.0,2 minutes,Two objects&#44 Teardrop shape&#44 slight red to orange glow in front and less of a glow in the rear.  Traveling South to North side by side,3/13/2012,34.6086111,-98.39
31782,2013-03-15 20:00:00,montoursville,pa,USA,circle,7200.0,2 hours,Montoursville sightings.,12/2/2013,41.2541667,-76.9208333
51520,2008-06-24 22:00:00,greensboro,nc,USA,chevron,5.0,5 seconds,Chevron shaped UFO over skies of Greensboro&#44 NC,7/5/2008,36.0725,-79.7922222
53030,2003-06-30 23:00:00,jamestown,ks,USA,circle,10.0,10 seconds,large light frightened the crap out of us.,12/12/2009,39.5994444,-97.8608333
28136,2014-02-22 19:00:00,stockton,ca,USA,circle,300.0,5 minutes,Red Lights In the sky.,2/27/2014,37.9577778,-121.2897222
61325,2008-07-03 16:40:00,fairbanks,ak,USA,unknown,120.0,2 minutes,White oblong object moving fast through clear sky and fades into the blue.,7/5/2008,64.8377778,-147.7163889
49683,1999-06-17 20:00:00,laguna vista,tx,USA,disk,1200.0,20 min.+,GOING OUTSIDE I LOOKED AT A PASSING AIRPLANE AND THEN WAY TO THE RIGHT AND MUCH HIGHER THAN THE PLANE I SAW OVER 20 SAUCER SHAPED OBJEC,7/5/1999,26.1005556,-97.29
68997,2002-08-23 03:45:00,albuquerque,nm,USA,flash,5.0,5sec,I was smoking a cigarette when I looked up and saw a little brite light  moving slow for about 5 seconds. Then i saw it flash with a br,8/28/2002,35.0844444,-106.6505556
24311,2002-01-03 21:35:00,richmond/bowdoin,me,Other,chevron,1200.0,20min,CHEVRON SHAPED OBJECT WITH BLIDING LIGHT AND NO SOUND FLYING AT VERY SLOW RATE OF SPEED OVER RICHMOND-BOWDOIN&#44 MAINE,1/11/2002,44.088104,-69.802574
45661,1999-05-05 23:00:00,phoenix,az,USA,light,30.0,several hours,body experiments by aliens,6/12/2002,33.4483333,-112.0733333
51697,2002-06-25 23:00:00,portland,or,USA,circle,900.0,15 minutes,Object appeared in the low horizon and it looked to me to be venus&#44 but then was moving east and rising slightly untill it was  about 4,7/1/2002,45.5236111,-122.675
54537,2011-06-09 11:00:00,i-95 (near nc/va border),nc,Other,fireball,30.0,30 seconds,White Fireball followed by two fighter jets.,6/27/2011,35.47251,-78.374786
78786,2010-09-30 22:30:00,terrebonne (rural area),mn,USA,light,3600.0,at least an hour,Bright white round light&#44doesn&#39t move&#44 gets very bright then almost fades out then repeats this for a long time.((NUFORC Note:  Star?)),11/21/2010,47.8325,-96.1330556
26950,2008-02-16 23:00:00,sacramento,ca,USA,flash,5.0,5 seconds,Small miniture light very high for 5 seconds. Then vanished upward,3/4/2008,38.5816667,-121.4933333
77034,2012-09-22 19:10:00,mesa,az,USA,circle,600.0,5-10 minutes,Four white round lights in a square formation,9/24/2012,33.4222222,-111.8219444
45521,2008-05-04 08:00:00,apache junction,az,USA,light,37800.0,1 to 1 1/2 hours,2 big&#44 white orbs of light spotted near the Superstition Mountains.,6/12/2008,33.415,-111.5488889
3804,2002-10-22 13:00:00,san francisco,ca,USA,cigar,21600.0,afternoon,Cigar shape&#44sliver color&#44hovering&#44in a group of trees&#44and it had two lights.,4/27/2004,37.775,-122.4183333
60119,2003-07-27 23:30:00,houston (canada),bc,Canada,light,3.0,3 seconds,HBCCUFO CANADIAN REPORT:  Bright light 3 times larger than Venus,8/1/2003,54.4,-126.65
69497,2001-08-25 21:00:00,healdsburg,ca,USA,triangle,300.0,5 minutes,triangular mass moving from west to east in the night sky&#44 at first thought it was 3 satillites moving together.,10/12/2001,38.6105556,-122.8680556
485,1957-10-01 16:00:00,nelchina (near),ak,USA,unknown,180.0,3 minutes maximum,This incident occurred about October of 1956 or &#8216;57. At the time&#44 I was Assistant station manager for a major airline in Anchorage as,12/7/2006,61.9919444,-146.7686111
42032,2001-05-13 20:00:00,rugeley (uk/england),,Britain,changing,2400.0,40 minutes,It was pureley by chance that this unidentified object was spotted by my friend and I&#44 I was preparing to go to work for the evening&#44 w,6/4/2004,52.766667,-1.933333
26480,2010-02-14 21:45:00,miami,fl,USA,unknown,240.0,4 minutes,Unknown  red  light objects  in the sky observed in Miami&#44  Florida,4/13/2010,25.7738889,-80.1938889
58311,2002-07-20 21:00:00,anaheim,ca,USA,teardrop,480.0,8 minutes,One object &#44 bell shapes&#44 was observed at approximately 2130 to 2138 It came from the south and at changing speeds moved across the sky,7/26/2002,33.8352778,-117.9136111
72989,2011-09-10 23:30:00,twin falls,id,USA,fireball,60.0,1 min,Orange fiery-looking orb appeared to be floating at the treeline.,10/10/2011,42.5630556,-114.46
40755,2011-04-07 23:00:00,barrie (canada),on,Canada,other,120.0,00:2 mins,FROM WHAT I COULD SEE IT FLEW THROUGH ABOUT 20 OR 30 MILES OF SKY IN LESS THAN 6 OR 7 SECONDS,5/2/2011,44.383333,-79.7
16014,2004-01-18 00:00:00,lakewood,co,USA,formation,1200.0,15-20 min.,Small&#44 circular objects floating in a chevron pattern (12 formations total) in a NNE direction over the Lakewood&#44 CO area.,1/22/2004,39.7047222,-105.0808333
28378,2004-02-24 21:00:00,gaffney,sc,USA,other,300.0,5 minutes,Gaffney&#44 SC&#44 Report. Bright Light With Sparks,7/5/2008,35.0716667,-81.65
50671,2007-06-21 23:10:00,mainz (germany),,Germany,light,4.0,4 sec,Very bright light moving for 4 sec&#44 then disappeared; course like facing Shuttle course at that time and location,8/7/2007,50.0,8.271111
4366,2012-10-24 10:00:00,santa rosa indian reservation,ca,Other,sphere,60.0,1 minute,Large&#44 shiny metallic object hovering over Santa Rosa Indian Reservation.,12/20/2012,33.521565,-116.457747
71102,2002-08-03 17:00:00,toronto (canada),on,Canada,circle,3600.0,1 hour,circles aroud Toronto,8/16/2002,43.666667,-79.416667
1247,1999-10-13 17:20:00,florence,ky,USA,triangle,600.0,10 min.,I 75 going south.  Triangle shape.  White light on each corner.  Not moving... no sound.,12/16/1999,38.9988889,-84.6266667
29880,2002-02-08 19:00:00,portland,or,USA,disk,3600.0,60 minutes +,Craft forms Triangle&#44 becomes portal right over 1-5,2/22/2002,45.5236111,-122.675
30329,2012-03-10 18:45:00,smithfield,nc,USA,fireball,300.0,apprx. 3-5 min,Five fireballs moving across sky in Johnston County NC,5/13/2012,35.5083333,-78.3397222
1666,2012-10-14 12:50:00,centralia,wa,USA,egg,900.0,15 minutes,Photo of an orange&#44 egg shaped light&#44 moving in a constant deliberate manner on a south to north course near Centralia&#44 Washington.,10/30/2012,46.7163889,-122.9530556
67183,2003-08-17 00:30:00,federal way,wa,USA,egg,180.0,3 minutes,Witnesses see six green glowing egg shaped objects overhead flying east followed by a flashing blue saucer&#33&#33,8/28/2003,47.3225,-122.3113889
79041,2013-09-03 21:15:00,yoder,ks,USA,sphere,600.0,10 minutes,Glowing orange sphere hovering at western horizon&#44 disappeared suddenly.,9/9/2013,37.9402778,-97.8680556
51764,2008-06-25 23:10:00,gray,tn,USA,triangle,600.0,10 min,((HOAX??))  bright red and white lights over gray&#44tn.,7/5/2008,36.4197222,-82.4766667
46750,2004-06-11 20:15:00,hyderabad (pakistan),,Other,triangle,15.0,10-15seconds,on a hot june night me and my friend Ali ahmed were chatting and we herd sound like it was comming from a fighter(s) we thaught it was,6/18/2004,17.385044,78.486671
14553,2012-11-04 09:15:00,upland,ca,USA,circle,10.0,10 seconds,Unusual faint white circle moving faster than a jet traveling south to northeast over Upland CA at approximately 09:10 am.,11/4/2012,34.0975,-117.6475
34625,1999-03-04 20:45:00,phoenix,az,USA,other,300.0,five minutes,We saw a very bright light that looked like a comet&#44 with a smoke looking trail coming from behind the light.,4/2/1999,33.4483333,-112.0733333
52359,2011-06-28 23:00:00,isle la motte,vt,USA,changing,300.0,5 minutes,An orb that disappeared into vapor and a flying vessel with a bank of four tail lights&#44,7/4/2011,44.8769444,-73.3391667
12005,2005-11-02 19:10:00,wyoming,mi,USA,sphere,600.0,30-40,((NUFORC Note: Probable sighting of Mars.  PD))    I observed what appeared to be an a/c on final to GR-Ford w/ landing lights.,11/3/2005,42.9133333,-85.7052778
67655,2001-08-19 21:00:00,bettendorf,ia,USA,light,240.0,4 min,I am a mature 54 year old adult that has never scene or reported something of this nature.  At 2100 hours I was standing outside my hou,8/20/2001,41.5244444,-90.5155556
68213,2013-08-20 05:30:00,pine bush,ny,USA,other,5.0,5 seconds,Odd lights in the sky over Pine Bush: commercial or extraterrestrial?,8/30/2013,41.6080556,-74.2994444
77225,2007-09-23 20:16:00,stratford,ct,USA,triangle,600.0,10 minutes,TWO TRIANGLE CRAFTS NO SOUNDS OBSERVED&#44,10/8/2007,41.1844444,-73.1336111
72320,1998-08-08 00:00:00,north charleston,sc,USA,unknown,480.0,8 minutes,Saw a UFO at night in the woods near power lines.,3/4/2008,32.8544444,-79.975
77131,1998-09-23 21:15:00,kent,wa,USA,oval,2.0,2 seconds,Bright fluorescent blue-green object&#44 flying very fast East to West&#44 in Southern sky. No noise. No tail&#44 but very phosphorescent. Calle,9/26/1998,47.3811111,-122.2336111
31790,2013-03-15 23:00:00,avondale,az,USA,light,300.0,5 minutes,Sighting of a silent bright glowing red orb over Avondale&#44 AZ.,5/15/2013,33.4355556,-112.3488889
2820,2011-10-18 03:15:00,queen creek,az,USA,cylinder,900.0,15 minutes,Cylinder flashing object stationary for 15 minutes.  Red and Blue lights close to object flashing.  Video Taped,10/19/2011,33.2486111,-111.6336111
34565,2012-03-03 19:00:00,st. charles,il,USA,triangle,25.0,25 seconds,Red lights in shape of a triangle down the sides with white lights across the base.one object flying west to east.,3/13/2012,41.9141667,-88.3086111
56226,2000-07-14 03:00:00,greensburg,pa,USA,other,600.0,10 minutes,Strange glow in the woods,2/22/2005,40.3013889,-79.5391667
43070,2010-05-18 22:00:00,helena,mt,USA,disk,120.0,two mins.,disk shaped object/ military choppers all around the object,6/3/2010,46.5927778,-112.0352778
31369,2008-03-14 23:00:00,north brunswick,nj,Other,flash,40.0,40 seconds,Explosion of light in North Brunswick,3/31/2008,40.452516,-74.476671
34201,2007-03-30 21:30:00,sugar notch,pa,USA,triangle,60.0,~1 minute?,3 Light Triangle / Wyoming Valley / Eastward,6/12/2007,41.1969444,-75.9286111
71396,2007-08-04 15:00:00,dorking&#44 surrey (uk/england),,Other,circle,240.0,3-4 mins,TWO WHITE CIRCULAR OBJECTS MOVING AT HIGH ALTITUDE &amp; SPEED.,8/14/2007,51.232202,-0.332378
14904,2006-01-15 02:00:00,waterloo,ny,USA,sphere,120.0,several minutes,White spherical object and missing time,3/11/2006,42.9047222,-76.8630556
60163,2007-07-27 23:30:00,florida (east of; over ocean),fl,Other,unknown,2.0,two seconds,object travelling at unimaginable speed crossed our flight path from right to left with a blue trail in the sky,8/7/2007,27.664827,-81.515754
69144,2012-08-23 22:00:00,grand rapids,mi,USA,light,45.0,45 seconds,Not sure what i seen but it wasnt man made 1,9/24/2012,42.9633333,-85.6680556
67805,2010-08-19 21:05:00,halifax (canada),ns,Canada,light,1200.0,20 min,Bright green light.,8/24/2010,44.65,-63.6
76082,2002-09-20 18:00:00,orzinuovi (italy),,Other,circle,30.0,30 sec,Blue light,7/23/2003,45.401405,9.924865
5478,2003-10-30 20:00:00,compton,ca,USA,light,600.0,10 minutes,Red Star like light in LA night sky,10/31/2003,33.8958333,-118.2191667
8305,2002-11-01 23:30:00,arroyo (puerto rico),pr,USA,triangle,30.0,30secounds,we saw what it looked to be a triangle shap object across the sky going in to the moutains it was very good experiance for me because t,11/4/2002,17.9677778,-66.0616667
23365,2012-12-07 21:49:00,dibrugarh (india),,Other,changing,240.0,3-4 minute,Red/green light in the South East sky of Dibrugarh&#44 Assam&#44 India.,12/20/2012,27.472833,94.911962
12707,2001-11-24 17:00:00,tionesta,pa,USA,light,25200.0,5-7 hrs,A storm was moving in that evening&#44 and we watched what first looked like someone shining a spotlight into the sky.  This is what we th,1/11/2002,41.4952778,-79.4561111
29037,2012-02-28 22:14:00,essex junction,vt,USA,flash,1.0,less than 1 second,BRIGHT BLUE FLASH IN THE SKY.  ((NUFORC Note:  Possible meteor.  PD)),3/13/2012,44.4905556,-73.1113889
20139,1974-12-24 23:50:00,tegucigalpa (honduras),,Other,disk,15.0,15 seconds,I could have reached out and touch the UFO,12/2/2000,14.083333,-87.216667
7937,2003-11-11 18:10:00,brandon,fl,USA,disk,900.0,15 min.,Glowing saucer-shaped light hovering&#44 then lowering.,11/26/2003,27.9375,-82.2861111
72998,2012-09-10 03:20:00,columbia,sc,USA,disk,20.0,20 seconds,My husband and I was driving on Charlesron highway towards lexingtin exit 61 when a bright green shaped object appeared in the middle o,9/24/2012,34.0005556,-81.035
47341,1983-06-01 10:00:00,nevada (over),nv,Other,other,900.0,15min,Inflight sighting,7/26/2002,38.80261,-116.419389
55538,2009-07-01 21:43:00,metarie,la,Other,fireball,5.0,4-5 seconds,I was taking out the trash when I noticed a flashing light on the lid of the can. I looked up to try and find the source and I saw a la,8/5/2009,29.984092,-90.152852
71551,1995-08-05 22:00:00,phillips,wi,USA,unknown,180.0,3 minutes,Field and woods light up by a red light that has no source. Light seems to scan area for about a minute. Object turns lights on and lan,1/28/1999,45.6966667,-90.4002778
15532,1995-01-17 22:45:00,anchorage,ak,USA,light,900.0,15 min.,Empl. of KRUA radio station at Univ. of AK calls to report multiple UFO reports 2245 hrs. 17JA95 over inlet.,11/2/1999,61.2180556,-149.9002778
21457,1999-12-31 23:59:00,sydney (nsw&#44 australia),,Other,light,180.0,3 mins,there were 3 of them &#44 maybe more but they were there and observing EVERYTHING.,3/16/2001,-33.861481,151.205475
686,2001-10-01 19:00:00,kansas city,mo,USA,light,900.0,15 minutes,3 bright lights at high altitude west of Kansas City at 2100 hours on 10/1/01 in a general westward movement.,10/12/2001,39.0997222,-94.5783333
68239,1978-08-21 19:00:00,monroe-bastrop,la,Other,rectangle,1800.0,20-30 minutes,Rectangular bright craft on Hwy 139 From Monroe to Bastrop&#44LA.,11/3/2005,32.746204,-91.978289
19216,2014-01-02 22:00:00,cape coral,fl,USA,light,300.0,5 minutes,Orange light hovering and then moving horizontal in Cape Coral&#44 Florida.,1/10/2014,26.5625,-81.9497222
59614,2000-07-25 20:50:00,gilbert,az,USA,unknown,1200.0,15-20 min,We saw 2 bright red lights&#44 one blinked on and off and dropped very rapidly after ~8 minutes&#44 the other blinked out ` 2 min later.,8/5/2000,33.3527778,-111.7883333
35567,2012-03-09 21:00:00,sheboygan,wi,USA,circle,1800.0,30 min,A USO under the water that seemed to move very slowly.,3/13/2012,43.7508333,-87.7144444
15383,2009-01-16 18:30:00,buffalo,mn,USA,light,7200.0,at least 2 hours,Bright&#44 white object with flashing red&#44 yellow&#44 green&#44 and blue lights hovering in the night sky seen from Buffalo&#44 Minnesota,3/19/2009,45.1719444,-93.8744444
65143,2009-08-01 03:00:00,monroe,ut,USA,light,1200.0,20 min.,Multiple orb ufo&#39s witnessed by four individuals.,12/12/2009,38.63,-112.12
78922,2006-09-03 01:30:00,north hollywood/burbank,ca,Other,fireball,1.0,1 second,Large green ball of light dropping from sky over North Hollywood/Burbank California.,10/30/2006,34.187044,-118.381256
73406,1991-09-01 19:00:00,boston (above),ma,USA,circle,30.0,20 to 30 secnds,The object was absolutely solid as I observed it&#44 but appeared to fly thru the windows.,12/14/2004,42.3583333,-71.0602778
34139,1999-03-30 21:08:00,covington/kent,wa,Other,fireball,1.0,1sec.,I saw a greenish glowing like fire ball in the direction of 230 degrees magnetic moving left to right opprox 30 degree angle.,4/26/1999,47.376894,-122.182325
39605,2013-04-28 21:00:00,bayonne,nj,USA,light,1800.0,30:00,We observed 1 object which was bright red traveling at a high speed past any planes that were in the area. The object stopped and then,5/15/2013,40.6686111,-74.1147222
53613,2002-06-05 19:30:00,oak ridge,tn,USA,sphere,1800.0,30 mins,Dark sphere hanging in the sky just before sunset.,8/16/2002,36.0102778,-84.2697222
74005,2012-09-12 06:30:00,piper city,il,USA,changing,300.0,3-5 minutes,Large silver vertical object hovering,9/24/2012,40.7566667,-88.1911111
7354,2011-10-09 19:30:00,murfreesboro,tn,USA,disk,240.0,4 minutes,30 bright lights seen moving in formation in Murfreesboro&#44 TN.,10/10/2011,35.8455556,-86.3902778
51157,2013-06-22 23:00:00,creston,ia,USA,light,10.0,10 seconds,Large white light moving quickly west to east,7/3/2013,41.0586111,-94.3611111
73883,2003-09-12 20:50:00,yakima,wa,USA,unknown,10.0,5-10 sec,mysterious 3 sets of 3 lights saw no clue what is was then a big flash pls read,9/17/2003,46.6022222,-120.5047222
79622,2010-09-06 03:35:00,kearny,nj,USA,triangle,1200.0,20 mins,Triangular shaped UFO flying over Kearny&#44  NJ,11/21/2010,40.7683333,-74.1458333
59693,2007-07-25 22:30:00,stratford (uk/england),,Britain,formation,1800.0,30min +,Cluster formation witnessed by Hundreds over Stratford UK.,8/7/2007,52.183333,-1.7
51351,2012-06-23 21:30:00,bridgman,mi,USA,oval,300.0,5 minutes,Saw 2 UFO&#39s oval shaped near Michigan Indiana border along I 94 glowing plasma orange and visible 5 mins,7/4/2012,41.9430556,-86.5569444
59999,2012-07-26 01:30:00,puyallup,wa,USA,flash,1.0,1 second,Moon size white light appears in the cloudless sky&#44 then moves quickly for one second and disappears.,8/5/2012,47.1855556,-122.2916667
77795,2004-09-26 08:05:00,batavia,ny,USA,teardrop,3.0,3 seconds,Tear-dropped shaped&#44 butane colored craft/fireball descending from SE to SW across sky.,9/29/2004,42.9980556,-78.1877778
42863,2004-05-17 07:45:00,culloden,wv,USA,,900.0,15 mins.,Witness claimed they saw a black figure run pass the window while cleaning. They also reported seing something fly past and a bright li,8/11/2004,38.42,-82.0555556
9786,1999-11-16 19:00:00,cleveland (northern),wi,USA,fireball,60.0,1 minute,Fireball,9/19/2002,43.915,-87.7472222
2631,2011-10-17 19:00:00,jacksonville,fl,USA,light,120.0,few minutes,My wife&#44 daughter&#44 and I witness a bright object moving North-North-East in the sky. It was a bluish-white colored light and stayed vis,10/19/2011,30.3319444,-81.6558333
57347,2005-07-16 01:00:00,pullman,wa,USA,oval,5400.0,1hour 30 min.,A disk in the field moving up and down.,10/8/2007,46.7313889,-117.1786111
55639,2013-07-01 21:30:00,brooklyn center,mn,USA,cigar,60.0,1 minute,Two cigar shaped objects one on top of the over outlined in white lights at dusk above trees on Twin Lake.,11/11/2013,45.0761111,-93.3325
63486,2004-07-07 19:00:00,englewood,co,USA,sphere,900.0,15 minutes,Starlike object seen again later in day,8/24/2004,39.6477778,-104.9872222
1449,2013-10-13 05:01:00,newark,tx,USA,circle,10800.0,3 hours,Craft was low above trees circling lookin for something to pick up spraying white powder.,10/14/2013,33.0011111,-97.4841667
18915,2013-12-18 23:40:00,santa rosa,ca,USA,light,30.0,30 seconds,UFO sighting in Santa Rosa&#44 California.,12/23/2013,38.4405556,-122.7133333
60092,2002-07-27 01:30:00,namur (belgium),,Other,triangle,60.0,1 minute,two girls  13 years old have seen during the night in  belgium; a triangle with 3 lights&#44 one was red and the shape was glowing into th,8/16/2002,50.467388,4.871985
11631,2008-11-20 10:15:00,phoenix,az,USA,light,60.0,1 minute,3 strangely colored(bronze&#44 copper&#44 orange red) very bright&#44 began very small&#44 and grew to very large&#44 disapeared&#44 and then reappeared,1/10/2009,33.4483333,-112.0733333
78107,2013-09-27 12:45:00,flint,mi,USA,unknown,5.0,5 seconds,Driving down ballanger to vanslyke about to go over the tracks  i catch a blue turquoise color ball out the corner of my eyes as soon a,10/3/2013,43.0125,-83.6875
38039,2013-04-20 20:30:00,oceanside,ca,USA,other,10.0,10 seconds,Silent group of lights moving  overhead.  Hovered briefly then reversed course and disappeared.,5/15/2013,33.1958333,-117.3786111
70462,2009-08-29 21:00:00,bloomingdale,il,USA,sphere,600.0,10 minutes approx.,bright lit-up orbs&#44 20-30 of them in the sky above Bloomingdale&#44 IL.,12/12/2009,41.9575,-88.0808333
69517,2003-08-25 04:45:00,sunbury,oh,USA,triangle,900.0,15 min,Large&#44 red triangle over Delaware County.,8/28/2003,40.2425,-82.8591667
18313,2002-12-15 23:00:00,marshall,nc,USA,oval,30.0,30 sec,A friend and I saw a round shape/object filled with strong white light cross the sky in a descend leaving smoky trace,12/23/2002,35.7972222,-82.6841667
60786,2002-07-30 20:40:00,union,ky,USA,unknown,20.0,10-20 seconds,10 to 20 second fly by in south western sky in Union Kentucky mysterious no noise&#44 super fast&#44 near CVG.,8/16/2002,38.9458333,-84.6805556
80253,2009-09-09 21:15:00,colebrook,nh,USA,other,120.0,2 min,oval-like craft with one blinking red light and a white the left and right side- turned clockwise until vertical &amp; top white separated,12/12/2009,44.8944444,-71.4963889
76583,2000-09-02 21:00:00,seattle,wa,USA,other,1200.0,about 1/2 hr.,one circular UFO with colored lights&#44 one fireball object&#44 revealed itself and disappeared.,9/17/2000,47.6063889,-122.3308333
24411,2011-01-03 22:40:00,national city,ca,USA,fireball,300.0,5 min,Fireball looking object floated over national city then dissapeared,1/5/2011,32.6780556,-117.0983333
41972,2012-05-12 21:30:00,eden prairie,mn,USA,circle,1200.0,15 - 20 minutes,Several reddish lights in the evening sky,5/13/2012,44.8547222,-93.4705556
59878,2002-07-26 01:15:00,arlington,va,USA,light,120.0,2 minutes,My son and I were in the back yard of our house a little after 1:00 in the morning last night. (about 1:15 am this morning).  We had go,7/30/2002,38.8902778,-77.0844444
42060,2004-05-13 03:00:00,san antonio,tx,USA,triangle,20.0,15-20 seconds,A peach colored blob moved straight toward me&#44 became a triangle craft&#44 turned around and vanished,6/4/2004,29.4238889,-98.4933333
44057,2012-05-23 02:20:00,hazelwood,mo,USA,other,45.0,30-45seconds,Stealth crescent banking maneuver .,7/4/2012,38.7713889,-90.3708333
48689,1968-06-15 20:30:00,wytheville,va,USA,disk,600.0,10 min,the domed saucer had lights around the dome&#44 and hovered close to the ground-with a loud humming noise.,6/12/2008,36.9483333,-81.085
9650,2012-11-15 20:00:00,gaithersburg,md,USA,changing,1200.0,20 minutes,4 Huge lights like spotlights reflecting across the clouds in a very strange pattern.  ((NUFORC Note:  Advertising lights.  PD)),11/19/2012,39.1433333,-77.2016667
29578,2003-02-06 06:10:00,arkport,ny,USA,changing,1200.0,20 minutes,Object in sky brighter than all others&#44 clear morning; moved from right to left and then in a circular pattern.,3/21/2003,42.3944444,-77.6969444
41882,2003-05-12 20:05:00,daytona (south daytona beach),fl,Other,light,90.0,1.5m,Light disperses in random pattern in Volusia County&#44 Florida.,5/13/2003,29.229602,-81.010845
76349,2004-09-21 05:30:00,portland,or,USA,circle,1200.0,20 min,At approx 5:30 AM I looked out my window and saw a large yellowish light in a circular form.  It almost looked like a bright city lamp,9/29/2004,45.5236111,-122.675
43688,2004-05-02 21:00:00,peoria,az,USA,unknown,1200.0,20 min?,At first it was noticed when a plane flew by. Then after the plane was gone we noticed a flashing light that appeard to be moving back,5/4/2004,33.5805556,-112.2366667
77893,2011-09-26 22:40:00,sydney (australia),,Other,diamond,360.0,6 minutes,Diamonds in the Sky.,10/10/2011,-33.861481,151.205475
73105,2001-09-11 21:22:00,santa fe,nm,USA,cone,37800.0,1 1/2 hours,We saw objects in the sky that could not have been stars. We observed them through bionoculars and saw 9 objects that hovered&#44 pulsated,10/12/2001,35.6869444,-105.9372222
12632,2011-11-23 23:00:00,hialeah,fl,USA,diamond,60.0,1 minute,Huge flash diamond in the sky.,12/12/2011,25.8572222,-80.2783333
46819,2011-06-11 00:00:00,lake stevens,wa,USA,unknown,1.0,1 sec,I seen a very bright light flash in the are of the Big Dipper.,6/12/2011,48.0152778,-122.0625
47335,1982-06-01 21:00:00,titusville,fl,USA,light,15.0,15 sec,3 lights appear in the sky&#44 rotating and seperate.,6/12/2007,28.6119444,-80.8077778
41046,2007-04-09 22:50:00,london (uk/england),,Britain,light,600.0,10 minutes,flaring ufo chased by helicopters,10/8/2007,51.514125,-0.093689
64477,1999-08-11 05:25:00,sellersburg,in,USA,light,25.0,25 seconds,Star-like light seen over trees moving and changing direction towards constellation Orion,8/30/1999,38.3980556,-85.755
58011,2001-07-19 23:59:00,godfrey,il,USA,light,3600.0,1 hour,My friend and I saw&#44 two nights in a row&#44 an odd &quot;wobbley&quot; light in the northwest sky behind our home in the country&#44 just over the tre,8/5/2001,38.9555556,-90.1866667
61470,2011-07-03 23:00:00,joliet,il,USA,fireball,600.0,10 min,20-25 fireballs over Joliet&#44 Il.,8/7/2011,41.525,-88.0816667
51229,2003-06-23 04:24:00,panama city,fl,USA,light,720.0,12 minutes,Panama City UFO,7/16/2003,30.1586111,-85.6602778
71685,2009-08-05 22:00:00,clovis,ca,USA,circle,600.0,10 min,circular object with twinkling lights,8/27/2009,36.8252778,-119.7019444
