,date_time,city_area,state,country,ufo_shape,encounter_length,described_encounter_length,description,date_documented,latitude,longitude
8281,2002-01-11 05:15:00,st. louis area,mo,Other,teardrop,20.0,20 seconds,the  object was fast moving &#44glowing  orange&#44 and fuzzy.,1/29/2002,38.768258,-90.184259
23369,2012-12-07 23:00:00,connersville,in,USA,cylinder,1740.0,29 minutes,December 7&#44 2012 Cylinder shaped&#44 transparent object appeared&#44 hazy gray color slow/fast movement.,8/30/2013,39.6411111,-85.1411111
65059,2004-08-01 03:30:00,wrightsville beach,nc,USA,formation,5400.0,1.5 hours plus,3-4 objects moving around eachother about 45 degrees over Wrightsville beach (Venus??),8/11/2004,34.2083333,-77.7966667
29305,2006-02-04 19:30:00,sioux falls,sd,USA,triangle,60.0,1 minute,Triangle object without  colored or blinking lights&#44 shortly later a bright shere shaped object was scene.,2/14/2006,43.55,-96.7
12391,2009-11-22 23:00:00,homestead and miami (between),fl,Other,flash,5.0,about 5 seconds,Three rainbow colored prisms in  teardrop shapes came out of no where and vanished over a bay between Homestead and Miami.,12/12/2009,25.474449,-80.474193
56039,2007-07-13 23:45:00,warr acres,ok,USA,diamond,1200.0,15-20 min,glowing hovering object viewed multiple times,8/7/2007,35.5225,-97.6186111
50864,2009-06-02 19:30:00,new york city (bronx),ny,USA,rectangle,20.0,20 seconds,Small UFO sighting at Yankee Stadium in daylight.,6/9/2009,40.7141667,-74.0063889
23872,2008-12-09 05:35:00,los angeles,ca,USA,light,180.0,3 minutes,Bright object  that slowly disappeared.,1/10/2009,34.0522222,-118.2427778
13351,1997-11-28 19:30:00,lake geneva,wi,USA,fireball,3600.0,abt 1 hr,Follow-up to article in Chicago Sun Times 12/3/97 re &quot;Fireball&quot; in Will Co&#44 Illinois 12/30.  Saw similar in Lake Geneva&#44 WI 11/28/97 ar,6/2/1998,42.5916667,-88.4333333
27864,2004-02-02 03:00:00,waxahachie,tx,USA,sphere,10.0,10 secconds,Bright&#44 red colored Spere&#44 sounded like a train&#44 seen twice,3/9/2004,32.3863889,-96.8480556
31268,1995-03-14 21:08:00,seattle,wa,USA,,2.0,2 sec.,Man &amp; son witness blue-green ball streak S to N in eastern sky.  Son frightened by observation.,11/2/1999,47.6063889,-122.3308333
75460,1991-09-18 23:00:00,montreal (canada),qc,Canada,triangle,60.0,about one minute,Black Triangle over Montreal,1/17/2004,45.5,-73.583333
73717,2012-09-01 09:15:00,fairview,pa,USA,light,60.0,1 minutes,It looked like a bright amber colored star flying at plane speed and altitude.,9/24/2012,42.0313889,-80.2555556
28249,2008-02-23 13:00:00,el paso,tx,USA,fireball,3.0,about 3 seconds,There was a flash and it vanished...,3/4/2008,31.7586111,-106.4863889
48165,2012-06-12 16:30:00,laporte,in,USA,egg,1.0,1 second,UFO&#39s buzz farm tractor and cars,6/20/2012,41.6105556,-86.7225
55572,2011-07-01 01:00:00,cincinnati (suburbs),in,USA,rectangle,240.0,2-4 minutes,One reddish orange  aircraft.,7/17/2011,39.02,-86.7288889
14982,2008-01-15 21:00:00,warrenton,nc,USA,circle,10.0,10 seconds,Craziest thing ive ever seen,9/24/2012,36.3983333,-78.1555556
31351,2007-03-14 02:50:00,lawrence,ks,USA,triangle,15.0,10-15 seconds,Two Isosceles Triangluar-shaped craft gliding effortlessly.,4/27/2007,38.9716667,-95.235
842,2006-10-01 23:20:00,grand junction (15-20 miles,co,Other,light,60.0,1 minute,6 LIGHTS FLOATING OVER DEBEQUE CANYON,10/30/2006,32.486673,-91.963994
12690,1998-11-24 18:25:00,valdosta,ga,USA,circle,10.0,10 seconds,2 pulsing redlights were flying around in circles then faded away&#44 a third identical craft appeared it stood still then faded away,9/28/2002,30.8325,-83.2786111
59965,2009-07-26 09:38:00,norwood -cincinnati,oh,Other,light,240.0,4 mins,Bright Light traveling towards the East then quickly fading out. No Sound at all.,8/5/2009,39.16448,-84.45428
39267,2013-04-26 23:00:00,austin,tx,USA,rectangle,20.0,20 seconds,The object almost impacted our windshield,5/15/2013,30.2669444,-97.7427778
26554,1955-02-15 21:55:00,welwyn garden city (uk/england),,Britain,fireball,1200.0,20 mins,2 orange lights like fireball stayed together quit low for 10 mins then one shot off so fast i could not beleive it,2/14/2010,51.8,-0.2
55447,2001-07-01 22:30:00,kimberling city,mo,USA,formation,3600.0,1 hour,We may have been an experament,6/18/2004,36.6333333,-93.4166667
54072,2002-06-07 23:00:00,decatur,il,USA,unknown,120.0,2 minutes,Sparkling UFO sighted outside of Decatur Illinois on Friday&#44 June 7th&#44 2002 @ 23:00,6/12/2002,39.8402778,-88.9547222
50440,2007-06-20 19:00:00,hamilton (canada),on,Canada,sphere,6.0,6 seconds,Brilliant golden boulder-like craft,8/7/2007,43.25,-79.833333
16607,2013-11-09 19:00:00,waikoloa,hi,USA,light,7200.0,2 hours,Huge orange/white ball of light with mini lights speeding by it and exiting it.  ((NUFORC Note:  Sighting of Venus?  PD)),11/11/2013,19.9430556,-155.7902778
37035,2008-04-15 17:00:00,rowland heights,ca,USA,diamond,120.0,2 minutes,Huge dark object flying over the san gabriel mountain,8/12/2008,33.9761111,-117.9044444
22749,2012-12-05 12:30:00,newark,de,USA,light,20.0,20 seconds,Green glowing silent orb moving S at 30&amp;#730; down from the horizon looking east near Kirkwood Hwy and Polly Drummond Hill Rd in Newark,12/20/2012,39.6836111,-75.75
74523,1959-09-15 01:00:00,goldfield,nv,USA,light,60.0,1 minute,The object hovered over the pick-up&#44 and raised it from the sand,4/16/2005,37.7086111,-117.2347222
3596,1994-10-02 00:00:00,bingen,wa,USA,fireball,900.0,15minutes to an hour,I was car camping with some friends at Bingen Marina. I was awakened by what I thought was a car pulling into the parking lot.  (no car,4/2/1999,45.715,-121.4633333
80290,2012-09-09 05:35:00,malden,ma,USA,triangle,60.0,1 minute,Triangular in shape. Moving forward and flying low. Lights blue&#44 yellow&#44 green. Was not revolving but instead moving like a plane would,9/24/2012,42.425,-71.0666667
27126,2011-02-17 18:30:00,austin,tx,USA,fireball,600.0,10 minutes or so,Bright lights in the sky,2/18/2011,30.2669444,-97.7427778
69256,2004-08-24 02:30:00,belleville (canada),on,Canada,unknown,1200.0,approx. 20 minutes,Large object with multy colored flashing lights.,9/1/2004,44.166667,-77.383333
61780,2003-07-04 22:05:00,tulelake,ca,USA,light,120.0,1-2 minutes,2 objects that looked like stars moving at high speeds,7/16/2003,41.9561111,-121.4763889
21747,2013-12-31 01:00:00,fairbanks,ak,USA,light,600.0,5-10 minutes,Six orange lights three differnt times from New Years Eve 11 pm to New Years Day 12:30 am.,3/18/2014,64.8377778,-147.7163889
30934,2008-03-12 01:00:00,lake elmo,mn,USA,unknown,240.0,3-4 min,A number of friends and I were at a party in lake elmo at around 1 am. We went outside for a smoke break on a cloudy and drizziling nig,6/12/2008,44.9958333,-92.8791667
7025,2000-10-08 18:20:00,chemung,ny,USA,other,300.0,5 minutes,contact information,12/2/2000,42.0083333,-76.6241667
4473,2001-10-25 14:30:00,terrel,tx,Other,oval,15.0,15 seconds,Large Circular Ball ufo Videotaped in Terrel Texas.,11/20/2001,32.735963,-96.275257
22319,2008-01-24 18:00:00,hammond,in,USA,unknown,600.0,10 minutes,Silent craft with 4 bright lights one red on top that floated then excelerated far and high in seconds.,10/31/2008,41.5833333,-87.5
22612,2005-12-05 23:00:00,centralia,wa,USA,circle,4.0,4 seconds,3 craft a faint white heading ne. makeing a full circle as they flew 4 seconds later thy were gone&#33 i know what i saw&#33,12/16/2005,46.7163889,-122.9530556
72832,2002-09-10 07:45:00,sedona,az,USA,sphere,600.0,10 minutes,I was driving into Sedona to work on route 179 at approximately 7:45am.  Shortly before the Villlage of Oak Creek my 10 year old son wh,9/19/2002,34.8697222,-111.7602778
16257,2012-11-08 23:00:00,pueblo,co,USA,unknown,20.0,20 seconds,Huge smoke like trail going across the sky,11/19/2012,38.2544444,-104.6086111
5813,2004-10-31 20:15:00,tinley park,il,USA,light,600.0,5-10 minutes,We saw 3 red lights in the Eastern sky traveling slowly in a straight line to the southeast. They then shifted into an L shape and held,11/2/2004,41.5733333,-87.7844444
9040,2013-11-13 21:15:00,roseville,ca,USA,circle,600.0,10 minutes,Bright Orange balls of light in the sky.  Stayed in one place for a few minutes then began moving North until they disappeared.,11/20/2013,38.7522222,-121.2869444
29301,2005-02-04 19:54:00,riverdale,ut,USA,light,3.0,2-3 seconds,Light was about the size of a BB held at arms length,2/8/2005,41.1769444,-112.0030556
12324,2005-11-22 04:00:00,hemet/south jacinto (outside of),ca,Other,light,604800.0,1 week,Bright light coming out of a shallow mountain&#33,12/16/2005,33.758728,-116.958712
23424,1996-01-28 21:00:00,peterborough (uk/england),,Britain,cross,300.0,3-5 minutes,glowing triangles in East Anglia U.K.,10/12/2001,52.583333,-0.25
6118,2006-10-03 23:25:00,orange,ca,USA,other,600.0,10 minutes,Oddly shaped object hovering above Orange County&#44 California&#44 then flying off under power.,10/30/2006,33.7877778,-117.8522222
13989,2002-11-03 17:40:00,chillicothe,tx,USA,cylinder,240.0,four minutes,Large white cylinder shaped object - stationary then accerated out of sight,11/4/2002,34.2563889,-99.5163889
28386,2005-02-24 19:20:00,coal hill,ar,USA,light,1800.0,30 minutes,Follow-up to report of orange lights sighted from Coal Hill&#44 02/24/05.Date 03/06/05. The acquisition of a detailed county map o,4/16/2005,35.4372222,-93.6727778
11651,2009-11-20 06:30:00,tucker,ga,USA,other,1800.0,30 min,iwas outside with my friends when we saw 5 ufos.,12/12/2009,33.8544444,-84.2172222
19253,1999-12-20 20:00:00,murrieta,ca,USA,light,420.0,7 min,group of red/orange objects over plateau followed car down road,5/24/2005,33.5538889,-117.2130556
62107,2010-07-04 21:09:00,portage,in,USA,light,60.0,1 minute,Silent&#44 orange glowing object below the clouds traveling SW to NE.,7/10/2010,41.5758333,-87.1761111
62162,2010-07-04 22:00:00,heathsville,va,USA,fireball,60.0,1 minute,During the fireworks display at 10PM&#44 4 of us witnessed a red/orange glowing sphere or disc shape moving silently&#44 smoothly and quickly,7/6/2010,37.9175,-76.4725
66523,1999-08-15 23:18:00,las cruces,nm,USA,fireball,20.0,10-20 seconds,a close friend of mine witnessed the same phenomenon (sp?) that was reported in northern new mexico 250 miles south of albuquerque&#44 in,7/1/2002,32.3122222,-106.7777778
23443,2000-12-08 19:09:00,gilbert,az,USA,oval,1080.0,app. 18 min,Red oval shaped ufo known as Bubba appeared over Mesa/Gilbert&#44 Az. last night 12/08/00,12/9/2000,33.3527778,-111.7883333
59910,2004-07-26 01:20:00,bolton (canada),on,Canada,unknown,2700.0,45 min,Bright red lights&#44 fading in and out&#44 white light could be seen flashing aound the object&#44 object moved sharply and quickly&#44no sound,8/11/2004,43.883333,-79.733333
67037,2010-08-16 20:15:00,circleville,ny,USA,light,60.0,1 minute,light coming strait at me like a plane from the SW&#44 (middletown area) and then shot up fast above the moon exiting the atmosphere.,8/24/2010,41.5141667,-74.3838889
9787,1999-11-16 19:00:00,cleveland,oh,USA,light,300.0,5min.,It was rock shape fire balls moving very slowly Over the raped station it was coming from east to west.,11/17/1999,41.4994444,-81.6955556
79304,2000-09-05 21:25:00,redding,ca,USA,triangle,240.0,4 minutes,Huge..floating west to east Redding&#44 CA...object that appeared to look like missles going across.in V shape&#44 no noise,12/23/2002,40.5866667,-122.3905556
35756,2012-04-10 02:54:00,livingston (east of),tx,USA,sphere,2400.0,40 minutes,The spherical object appears below the horizon and changes direction. Game camera photos over 40 minutes.,6/8/2012,30.7108333,-94.9327778
62579,2012-07-04 23:30:00,lexington,ky,USA,light,120.0,2 minutes,Two red lights seen moving near each other until disappearing.,8/5/2012,37.9886111,-84.4777778
11075,2007-01-01 19:00:00,chicago,il,USA,light,3600.0,approx. 1 hr. or so,Ball of changing light colors,2/1/2007,41.85,-87.65
44113,2003-05-24 01:30:00,vernal,ut,USA,flash,30.0,:30,There were strobing lights that were stationary then appeared to take off and fly away in an faster than possible.,6/3/2003,40.4555556,-109.5280556
22988,2008-01-26 18:15:00,los angeles,ca,USA,rectangle,300.0,5 minutes,1-28-08 5 Large burning pieces entering atmosphere over Los Angeles,2/14/2008,34.0522222,-118.2427778
62407,2012-07-04 03:00:00,springfield,oh,USA,light,3600.0,1+ hours,Sporadically moving star,7/4/2012,39.9241667,-83.8088889
38946,2014-04-24 21:39:00,huntington beach,ca,USA,fireball,120.0,2 minutes,Two fast orbs in Huntington Beach.,5/2/2014,33.6602778,-117.9983333
42683,2013-05-15 13:00:00,chester,sc,USA,other,20.0,20 seconds,A small sphere that hovered above the air strip and zig zagged in the same area&#44 hovered&#44 and zig zagged some more.,6/2/2013,34.7047222,-81.2144444
8737,2008-11-12 08:05:00,bumpass,va,USA,circle,20.0,20 seconds,The Craft Was An Orange Orb That Blinked then Dimmed And Kept Blinking Until It Sped Away And Disappeared. There was only one of the ob,1/10/2009,37.9633333,-77.7375
3014,2011-10-19 01:54:00,denver,co,USA,formation,5.0,5 seconds,Silent V formation over Denver&#44 CO.  ((NUFORC Note:  Report from law enforcement officer.  PD)),10/19/2011,39.7391667,-104.9841667
76275,2013-09-20 23:00:00,latham,ks,USA,circle,3600.0,>1 hour,Flashing colors like ball that never moved.,9/30/2013,37.5361111,-96.6416667
63432,2000-07-07 21:21:00,red rock canyon,nv,Other,oval,1380.0,23 minutes,Silent craft within 3 miles comes to with in 1/2 mile&#44 very close to ground; observed for 23 minutes.,7/11/2000,36.163578,-115.505288
23591,2008-01-28 20:15:00,waynesburg,oh,USA,triangle,10.0,approx. 20:15 thru 20:30,Amber triangular craft seen in Northeast Ohio,2/14/2008,40.6677778,-81.2575
72672,2008-08-09 22:00:00,baton rouge,la,USA,fireball,180.0,3 minutes,Fire in the sky,8/12/2008,30.4505556,-91.1544444
65168,2010-08-01 01:30:00,south elgin,il,USA,sphere,120.0,1 to 2 minutes,two orange craft approx. 1/2 mile apart moving west,8/24/2010,41.9941667,-88.2922222
72760,1976-09-10 22:00:00,new york city (bronx),ny,USA,disk,900.0,15 minutes,1976 Sighting - 2 disks over NY city.,5/14/2002,40.7141667,-74.0063889
9010,2012-11-13 20:30:00,columbus,oh,USA,formation,120.0,few minutes,Three red lights in consistent formation&#44 occasionally vanishing&#44 and re-appearing.,11/19/2012,39.9611111,-82.9988889
17790,2012-12-12 07:30:00,charleroi,pa,USA,unknown,300.0,5 minutes,High speed aircraft flying in groups of two and singles at high altitudes spotted approximately 7:30 P.M. over the skies of southwester,12/20/2012,40.1377778,-79.8983333
72670,2008-08-09 21:00:00,spring,tx,USA,circle,900.0,15 min,Large&#44 glowing bright circular object moving accross sky. No sound or strobe lights. Slowly moving &amp; then sped up &amp; vanished,8/12/2008,30.0797222,-95.4169444
15767,2010-11-07 00:30:00,canajoharie,ny,USA,flash,3600.0,1 hour +,UFO object with flashing red&#44 blue and green lights.  ((NUFORC Note:  We suspect a possible &quot;twinkling&quot; star.  PD)),11/21/2010,42.9055556,-74.5722222
29379,2012-02-04 21:55:00,annandale,nj,USA,fireball,120.0,2 mins?,Slow moving&#44 silent orange fireball,2/10/2012,40.6408333,-74.8816667
2104,2004-10-15 06:55:00,great falls,mt,USA,unknown,2.0,seconds,5 or 6 elliptical lights appear in front of truck and then suddenly move over it and disappear,10/27/2004,47.5002778,-111.3
21443,1998-12-31 23:59:00,appleton,wi,USA,teardrop,60.0,1 minute,I was at a party waiting for 1999 I saw 6 crafts which formed a triange.,5/24/1999,44.2619444,-88.4152778
23459,2002-12-08 17:30:00,green bay,wi,USA,triangle,60.0,1 minute,Triangular Pattern of lights over Lambeau Field 12/8/02,12/23/2002,44.5191667,-88.0197222
78282,2011-09-28 22:45:00,manchester,ct,USA,flash,900.0,15 mins,on the above date and time at 2245 pm driving home off I-84 manchester glowing pulsating light above rain clouds it was raining hard in,10/10/2011,41.7758333,-72.5219444
66698,2006-08-15 19:30:00,red bank,nj,USA,other,240.0,4 minutes,UFO looks like Chemical Structure of Carbon.,10/30/2006,40.3469444,-74.0647222
74764,2000-09-15 19:00:00,belfield,nd,USA,disk,900.0,10-15 minutes,first I see a bright light appearing like a very bright star&#44 it starts to waver&#44 which called my attention to it&#44,8/28/2002,46.8852778,-103.1991667
1813,1981-10-15 16:30:00,san jose,ca,USA,disk,420.0,7 minutes,Town and Country Shopping Center&#44 dic shaped craft at about 20feet above the ground...around 4:30PM on a Sunday.,2/14/2008,37.3394444,-121.8938889
19131,2007-01-02 19:00:00,newport beach,ca,USA,unknown,600.0,10 minutes,UFO spotted over Newport Beach suburb of Corona del Mar&#44 CA at 19:00 Jan. 2&#44 2007 by 2 witnesses,2/1/2007,33.6188889,-117.9280556
40963,1998-04-09 23:45:00,costa mesa,ca,USA,egg,600.0,10min,one object sighted,9/19/2002,33.6411111,-117.9177778
59611,2000-07-25 20:15:00,gilbert,az,USA,circle,420.0,5-7 minutes,Two bright red-orange objects over Gilbert for 5-7 minutes with no sounds,7/29/2000,33.3527778,-111.7883333
16204,2011-01-18 22:07:00,ione,wa,USA,fireball,1.5,1.5 seconds,Redish-Orange object falling ne to sw in souther sky south of Sullivan Lake&#44 Ione&#44 Wa,1/31/2011,48.7411111,-117.4161111
26403,2004-02-14 04:00:00,caribbean (in a cruise) (mexico),,Other,light,900.0,15 mins,they werent planes they were UFOS,3/2/2004,21.469114,-78.656894
27509,2003-02-20 22:15:00,wellington cap-egmont (canada),pe,Other,light,3600.0,1 hour 10:15pm-11:15pm,Me and my father have seen a odd light on top of the Northumberland Strait almost every night from 10:00pm to 11:00pm for at lease the,2/25/2003,46.402822,-64.132388
213,2010-10-10 02:30:00,harrisburg,pa,USA,circle,240.0,4  minutes,possible UFO sighting,11/21/2010,40.2736111,-76.8847222
51698,2002-06-25 23:12:00,orting,wa,USA,other,20.0,20 seconds,Object (satellite?) displayed  short&#44 intense increase in magnitude before vanishing ( near Ursa Major).,7/1/2002,47.0980556,-122.2030556
23705,2014-01-28 19:17:00,bowling green,ky,USA,fireball,5.0,5 seconds,Shooting&#44 burning star.,1/30/2014,36.9902778,-86.4436111
43608,2010-05-21 00:05:00,san jose,ca,USA,light,300.0,5 min,Light very irregular movement in sky.,6/3/2010,37.3394444,-121.8938889
28214,2004-02-23 01:00:00,scottsdale,az,USA,fireball,900.0,15 minutes,There was an object fireball/light,3/2/2004,33.5091667,-111.8983333
46051,2004-05-07 02:05:00,cumming,ga,USA,unknown,40.0,forty seconds,I think it could have been a meteor but my partner thought it could have been a UFO  it was very bright and traveled across the sky smo,5/10/2004,34.2072222,-84.1402778
20535,2010-12-25 20:00:00,glasgow (uk/scotland),,Britain,sphere,3600.0,1 hour,UFO&#39s in formation over southside of glasgow&#44 proceeded to return over the course of a few weeks.,11/19/2012,55.833333,-4.25
20656,1997-12-26 21:35:00,bonham,tx,USA,unknown,180.0,2 to 3 minutes,Red object moving west to east&#44 person looking southward.  Appear as large as airplanes approaching Dallas/Ft.Worth airport  but travel,3/7/1998,33.5772222,-96.1780556
59304,2011-07-23 16:00:00,fredericksburg,va,USA,cigar,30.0,30 seconds,Large wingless aircraft,8/7/2011,38.3030556,-77.4608333
74453,2012-09-14 17:00:00,laguna niguel,ca,USA,sphere,1200.0,20 minutes,Silver ball in California&#39s Sky.,8/30/2013,33.5225,-117.7066667
23028,2010-12-06 18:00:00,chino hills,ca,USA,light,3600.0,1hr,White Lights Over Inland Empire CA,1/5/2011,33.8936111,-117.7263889
52944,1999-06-30 06:00:00,hinton (canada),ab,Canada,other,3600.0,1 hour,Looks like a bright light in the night sky.((NUFORC Note:  We are experiencing difficulty obtaining detailed information.  PD)),2/8/2011,53.4,-117.583333
36162,2007-04-01 23:00:00,lynn,ma,USA,circle,900.0,15 minutes,Red light over Lynn&#44 MA.,4/27/2007,42.4666667,-70.95
68794,2002-08-22 23:40:00,monroe,ny,USA,egg,300.0,5 minutes,Orb- brilliant white on Rt 17&#44 NY,3/21/2003,41.3305556,-74.1872222
73563,2003-09-01 20:30:00,seattle (alkii beach),wa,USA,light,5.0,2-5 sec.,Bright light  flashed and moved up(vertical),9/4/2003,47.6063889,-122.3308333
70931,2008-08-31 01:25:00,vilivere (estonia),,Other,unknown,30.0,about 30sec,(sorry abot my englis grammatics..) Undefined flying object (UFO?) with circling red flashing lights&#44 it flown very low high at a very,10/31/2008,59.201412,24.713059
1092,2005-10-12 22:00:00,san jose,ca,USA,unknown,300.0,5 minutes,Possible Chinese Spacecraft Launch??,10/20/2005,37.3394444,-121.8938889
74069,1998-09-13 23:10:00,bradenton,fl,USA,other,6.0,6 seconds,Dimmed orange lights in formation of a half circle--six lights in semi-circle with one light in center of semi-circle,9/26/1998,27.4986111,-82.575
30764,2012-03-01 20:00:00,summerville,sc,USA,circle,10.0,5-10 secs.,The star that moves in South Carolina,5/13/2012,33.0183333,-80.1758333
55800,2008-07-12 09:00:00,texhoma,ok,USA,unknown,600.0,10 min,The green light zoomed across the lake leaving a splitting wake that parted the water.,12/12/2009,36.505,-101.7825
55674,1994-07-12 21:40:00,osage beach,mo,USA,changing,420.0,5-7 minutes,Bright Object in sky that appeared to be falling then stopped split into two object then back to one then sped off.,3/21/2003,38.1502778,-92.6177778
2904,1999-10-19 20:00:00,superior,co,USA,light,720.0,approx 12 min,Triangular formation of lights observed shortly after sunset&#44 rotated every few seconds. Other aircraft lights observed in area but did,11/2/1999,39.9527778,-105.1680556
78165,2002-09-28 20:30:00,key west,fl,USA,fireball,30.0,30 seconds,Can someone tell me what this is?,9/29/2002,24.5552778,-81.7827778
34541,2010-03-03 08:00:00,cleveland,oh,USA,unknown,900.0,15 minutes,It was late at night and I was over my grandmother&#39s house awaiting my mother to pick me up. We both looked up into the dark night sky,11/20/2013,41.4994444,-81.6955556
75215,2012-09-16 22:00:00,michigan (upper),mi,Other,light,120.0,1 1/2 minutes,Lights in the night sky.,5/15/2013,44.314844,-85.602364
51012,2005-06-22 22:30:00,baker city,or,USA,light,420.0,7 minutes,Three lights in triangular formation.,7/5/2005,44.775,-117.8333333
25138,2012-01-07 16:00:00,ashville,oh,USA,sphere,10.0,10 seconds,At 3:30 on January 7&#44 2012 I was hunting on my fathers farm just South of Ashville&#44 Ohio.  I was looking up at the sky and  all of a su,1/12/2012,39.7155556,-82.9530556
27755,2013-02-21 19:00:00,long lake,mn,USA,chevron,180.0,2-3 minutes,Stationary Chevron Shaped White Lights.,2/28/2013,44.9866667,-93.5713889
70909,2005-08-31 22:45:00,fairport,ny,USA,light,930.0,30 seconds/15 minutes,A couple of friends and my self were sitting in the park in the village when I looked to my left and noticed a ball of orange like ligh,10/11/2005,43.0986111,-77.4422222
21423,1989-12-31 23:00:00,ocala,fl,USA,triangle,600.0,10 minutes,TRIANGULAR CRAFT MADE 90 DEGREE TURNS,9/2/2005,29.1869444,-82.1402778
54166,2010-06-07 20:00:00,san diego,ca,USA,triangle,15.0,15 seconds,floating tranparent wing in the sky over san diego,6/23/2010,32.7152778,-117.1563889
33030,2007-03-22 19:00:00,beaverton,or,USA,cigar,180.0,2-3 mins,Multiple cigar shaped objects flying around each other then shooting across the sky.,4/27/2007,45.4872222,-122.8025
36914,1999-04-15 22:00:00,stone mountain,ga,USA,light,2400.0,40 minutes,LIGHTS IN A CIRCULAR FORMATION.  THEY WERE ALMOST FLUID IN MOVEMENT.  THE LIGHTS ROTATED FROM THE INNER CIRCLE AND MOVED OUTWARD IN A R,4/26/1999,33.8080556,-84.1702778
52591,1946-06-30 21:00:00,index,wa,USA,fireball,30.0,30 sec,Greenish fireball flying nearly horizontal and Greyish figure 1-2 Mo. later,1/10/2009,47.8208333,-121.5538889
68765,2000-08-22 21:30:00,seattle,wa,USA,unknown,30.0,30 seconds,Bright slow moving object that became brighter during its path across the entire sky.,8/25/2000,47.6063889,-122.3308333
6172,2010-10-03 23:00:00,dubuque,ia,USA,unknown,3600.0,1 hr,ok i didnt see it but i heard about it and was hoping you could find out more a friend told me that lastnight her friend seen a craft a,11/21/2010,42.5005556,-90.6644444
22127,2013-12-03 18:42:00,sebastian,fl,USA,fireball,180.0,3 minutes,fireball in sky,12/5/2013,27.8161111,-80.4708333
56948,2001-07-15 00:30:00,patchouge,ny,Other,oval,4.0,4 seconds,The observer was driving his auto with a companion along route 27 on the service road east. An oval shaped object passed overhead&#44 ahea,8/5/2001,40.765654,-73.015108
17779,2011-12-12 04:30:00,tacoma,wa,USA,flash,1.0,1 sec,Green flash with maybe a little red and white lights&#44 it went by very fast,12/17/2011,47.2530556,-122.4430556
56943,2001-07-15 00:30:00,carteret,nj,USA,other,900.0,15 mins,Strange lights over Carteret,8/5/2001,40.5772222,-74.2286111
21402,2013-12-30 01:00:00,grand junction,co,USA,unknown,1800.0,30 minutes,Bright orange glow illuminating south Douglas Pass north of grand Junction&#44 CO.,1/10/2014,39.0638889,-108.55
21557,2008-12-31 16:30:00,louisville,ky,USA,light,300.0,5 minutes,White Light Object appears in the sky and speeds away below the horizon,1/10/2009,38.2541667,-85.7594444
27348,2005-02-19 14:35:00,rockville,md,USA,cigar,10.0,10 seconds,Cigar-shaped object seen for several seconds then disappeared from area of sight.,2/22/2005,39.0838889,-77.1530556
61241,2001-07-03 18:45:00,manchester,ct,USA,other,1800.0,30 +min.,I saw a motionless&#44 noiseless ufo that appeared to be under investigation of some other aircraft.,8/5/2001,41.7758333,-72.5219444
18075,2001-12-14 23:30:00,washington&#44 d.c.,dc,Other,triangle,120.0,1-2 minutes,Three lights in a triangular formation being followed by a smaller light.,9/6/2002,38.907231,-77.036464
27796,1992-02-02 03:00:00,makawao,hi,USA,other,120.0,one hour,Visitation of beings into my home where I actually &#39heard&#39 a voice from the being.,2/25/2003,20.8569444,-156.3130556
41887,2004-05-12 04:02:00,boulder,co,USA,formation,30.0,30 seconds,5 glowing golden cigar shaped discs moving in formation,6/4/2004,40.015,-105.27
883,2008-10-01 20:00:00,texas city,tx,USA,other,2.0,2 seconds,very strange&#44 unexplainable sound,8/27/2009,29.3836111,-94.9025
