,date_time,city_area,state,country,ufo_shape,encounter_length,described_encounter_length,description,date_documented,latitude,longitude
28008,2001-02-22 19:45:00,carroll,ia,USA,light,30.0,30 seconds,unbelievable&#44 five large orange/yellow bright spheres appearing one after another moving quickly across the sky and disappearing.,2/24/2001,42.0658333,-94.8666667
1345,2007-10-13 01:59:00,iroquois falls (canada),on,Canada,triangle,120.0,approxmately 2 minutes,triangular shaped craft with lights at each point&#44 rotating over remote northern Canadian town. report 30 minutes after witnessing.,3/4/2008,48.766667,-80.666667
13993,2002-01-13 23:53:00,paintsville,ky,USA,light,10.0,10 sec,dont know if train/ufo was hoax&#44 but do know there was something strange in the area that night,11/21/2010,37.8144444,-82.8072222
51872,2000-06-26 22:00:00,st. george,ut,USA,light,1200.0,20 min,Small non blinking lights flying with the stars,7/11/2000,37.1041667,-113.5833333
55486,2005-07-01 02:00:00,portage la prairie (canada),mb,Canada,light,1800.0,~20-30 minutes,Face to face with the unknown.,5/2/2014,49.966667,-98.3
8386,2006-11-01 22:00:00,milton,wv,USA,light,60.0,< 1 min,Bright light (no meteor) crossed the sky from horizon to horizon in less than one minute.,3/8/2007,38.4344444,-82.1325
27853,2002-02-02 23:35:00,urbana,il,USA,light,1500.0,25 minutes,7 to 9 large&#44 bright amber lights moving from southwest to northeast over Illinois,2/22/2002,40.1105556,-88.2072222
55887,2013-07-12 22:07:00,vancouver (canada),bc,Canada,light,120.0,minute,Amber/red right.,7/14/2013,49.25,-123.133333
26191,1979-02-13 01:00:00,alexandria,va,USA,light,120.0,a few minutes,white light over Alexandria at night grew in intensity-took three pictures,2/14/2008,38.8047222,-77.0472222
32110,2012-03-17 20:43:00,lansing,mi,USA,light,30.0,30 seconds,Two flashing lights moving in sky over Lansing&#44 MI,5/13/2012,42.7325,-84.5555556
74666,1993-09-15 18:00:00,bishop,ca,USA,sphere,600.0,5-10 minutes,Large sphere witnessed at music festival.,3/31/2008,37.3636111,-118.3941667
6357,2010-10-04 23:54:00,mariposa,ca,USA,circle,1800.0,30 minutes,UNRECOGNIZED ORB taveling lights&#33&#33 PLEASE TAKE A LOOK&#33,11/21/2010,37.485,-119.9652778
73517,2000-09-01 23:12:00,orchard park,ny,USA,other,45.0,30-45 seconds,Three lights skull/heart shape. flew low made loud noise.,9/17/2000,42.7675,-78.7441667
57622,2009-07-17 00:00:00,santa fe,nm,USA,light,120.0,minutes,Odd lights - objects in sky.,12/12/2009,35.6869444,-105.9372222
18176,2012-12-14 06:00:00,cincinnati,oh,USA,light,5.0,5 seconds,Bright orb &quot;free falling.&quot;,12/20/2012,39.1619444,-84.4569444
18558,2007-12-16 18:30:00,tampa/leesburg (between),fl,Other,disk,300.0,5 mins,5 discs along I-75,10/10/2011,28.810823,-81.877858
65567,2013-08-12 00:00:00,sanibel,fl,USA,unknown,1800.0,30 minutes,It was a reddish orange flickering light that appeared to be from a hovering aircraft along the edge of a storm cloud.,8/30/2013,26.4486111,-82.0225
15109,2012-01-15 21:24:00,murphysboro,il,USA,light,15.0,15 sec,Pinkish light zig zags in sky.,1/24/2012,37.7644444,-89.335
39858,2004-04-30 18:30:00,portland,or,USA,circle,900.0,10 - 15 minutes,Object Hovering Near Jet-Trails 4/30/04&#44 Portland&#44 Or.,5/4/2004,45.5236111,-122.675
53966,2010-06-06 02:00:00,new york city (brooklyn),ny,USA,sphere,3600.0,1 hour,Star like object and reddish sphere sighting.  ((NUFORC Note:  Venus??  PD)),6/10/2010,40.7141667,-74.0063889
2960,2007-10-19 18:30:00,boca raton,fl,USA,oval,300.0,5 minutes,UFO&#39s over Boca Raton&#44 Florida.,11/28/2007,26.3583333,-80.0833333
42194,2004-05-14 03:40:00,spring wood,va,Other,triangle,60.0,1 minute,possible triangular shaped craft w/green light and blinking red light hovering over i 81 north at the 162 mile marker in virginia,6/4/2004,38.285092,-77.48311
3749,2013-10-02 00:08:00,marshville,nc,USA,other,10.0,10 seconds,Strange glowing line moving across the sky.,10/3/2013,34.9883333,-80.3672222
6258,2000-10-04 22:47:00,richwood,tx,USA,fireball,20.0,20 seconds,It looked like a fireball chasing after something.,12/2/2000,29.0558333,-95.4097222
56091,2011-07-13 20:10:00,montreal (canada),qc,Canada,changing,300.0,5 minutes,Two morphing golden shapes flying over Montreal in the evening on July 13th&#44 2011.,7/17/2011,45.5,-73.583333
78226,2007-09-28 23:10:00,humble,tx,USA,rectangle,10.0,10 seconds,Very fast-moving object&#44 bright with an apparent trail&#44 headed Northeast and losing altitude near Humble&#44 Tx.,10/8/2007,29.9986111,-95.2619444
31376,2009-03-14 18:30:00,cancun (mexico),,Other,cigar,120.0,2 min,cigar-shaped orange emitting light over the beach in Cancun&#44 Mexico,4/14/2009,21.161908,-86.851528
26790,2012-02-15 03:00:00,midland,nc,USA,fireball,60.0,1 minute,3 AM - 2009 &amp; 2012 - NC - sphere - white light POSTED:  06.21.12,7/4/2012,35.2272222,-80.5008333
54070,2002-06-07 21:00:00,taunton,ma,USA,other,60.0,1 minute,Any explanations?,6/12/2002,41.9,-71.0902778
13913,2013-11-30 21:10:00,sag harbor,ny,USA,fireball,180.0,3 minutes,Fireballs visit Long Island again.,12/12/2013,40.9977778,-72.2930556
42242,2009-05-14 19:20:00,rocha (uruguay),,Other,fireball,30.0,30 seconds,Crossing the Palmera bridge&#44 south of Rocha and noticed a bright sun-ball moving silently over some trees to my left. The ball was yell,6/9/2009,-33.967495,-53.910659
60256,2013-07-27 02:00:00,san antonio,tx,USA,changing,2700.0,45 minutes,Triangle and oblong shaped saucers,8/30/2013,29.4238889,-98.4933333
42289,1953-05-15 16:00:00,toronto (canada),on,Canada,disk,30.0,20-30 sec,3 discs in formation flipping into clouds and descending  out of them.,12/19/2003,43.666667,-79.416667
7886,1995-11-11 18:25:00,rock island,wa,USA,light,20.0,20 sec.,Man on Hwy 28 sees extremely bright obj. &quot;shoot across windshield&#44&quot; blow up into many fragments when it entered cloud of fog.,11/2/1999,47.3772222,-120.1427778
41873,2002-05-12 16:10:00,newark,nj,USA,rectangle,6.0,4 to 6 seconds,Strange sound from sky near internation airport,5/14/2002,40.7355556,-74.1727778
57085,2005-07-15 22:00:00,salem,or,USA,light,1.0,1 second,Stationary light seen in night sky for one second,9/2/2005,44.9430556,-123.0338889
74153,2005-09-13 21:15:00,salem,or,USA,light,6.0,5-6 seconds,I was in the parking lot and happened to look up and saw a bright light (-6 or -7 in magnitude) traveling southeast from approximately,9/15/2005,44.9430556,-123.0338889
50934,2013-06-02 22:30:00,wichita,ks,USA,sphere,30.0,30 seconds,Moving across the sky .. Orange sphere .. running totally silent,7/3/2013,37.6922222,-97.3372222
73753,2012-09-01 23:00:00,pomona,ca,USA,light,2.0,seconds,Blue light shined back yard for seconds and disappears Looked at the sky immediately and found nothing crazy&#33,9/24/2012,34.0552778,-117.7513889
17121,2004-12-11 19:55:00,manassas,va,USA,light,20.0,15 - 20 sec.,Huge glowing green object in Northern VA.  ((NUFORC Note:  Possible meteor.  PD)),12/14/2004,38.7508333,-77.4755556
61248,2002-07-03 12:30:00,wall,nj,Other,circle,10.0,10 seconds,An object traveling from the North to the South in less than a second and had zigzagged at one point&#44 than flew off.,7/26/2002,40.160667,-74.067975
63273,2013-07-06 20:55:00,carlsbad,ca,USA,oval,180.0,3 minutes,Red/orange orb over Carlsbad&#44 CA,7/14/2013,33.1580556,-117.3497222
32964,1995-03-22 05:10:00,bedford,va,USA,,3600.0,1 hour,Man&#44 co-workers witness strange&#44 amber light darting fast in morning sky.  Faded and reappeared three times.,11/2/1999,37.3341667,-79.5233333
37898,2001-04-20 01:30:00,reidsville,nc,USA,cigar,1200.0,20 minutes,Reidsville Prom Sighting,8/5/2001,36.3547222,-79.6647222
29065,2014-02-28 21:30:00,winslow township,nj,Other,fireball,2.0,2 seconds,Small green fireball/light shoots straight down.,3/18/2014,39.657356,-74.86232
68236,1961-08-21 11:40:00,kelowna (canada),bc,Canada,changing,20.0,10-20 seconds,((HOAX??))  Reddish orange pulsating star.,2/27/2014,49.9,-119.483333
33397,2014-03-24 22:00:00,reynoldsville,pa,USA,egg,45.0,45 seconds,3 Orange blinking lights moving about 2x faster then a plane.,3/27/2014,41.0969444,-78.8888889
76851,2001-09-22 09:15:00,daniel&#39s park,co,Other,sphere,60.0,60 sec,UFO seen over Daniel&#8217;s Park Southwest of Denver Colorado,2/22/2002,39.487938,-104.932108
71593,2002-08-05 22:29:00,toronto (canada),on,Canada,other,2.0,2 secs,red object flying low over Toronto at night,8/16/2002,43.666667,-79.416667
34925,1996-03-06 19:00:00,frankfort,il,Other,other,600.0,10 min.,Object was 50 ft. across the bottom&#44 dome on the top&#44red&#44green&#44 and blue lights on the sides around&#44150 approx. off the ground.,1/28/1999,41.495867,-87.848661
72339,2000-08-08 23:41:00,arnold,mo,USA,light,1200.0,15-20 minutes,Three lights came out of the sky and circled and dissapeared.,8/19/2000,38.4327778,-90.3775
55681,1998-07-12 02:50:00,centerville,oh,USA,light,60.0,1 minute,Bright flashing light in an orangish color from the sky.,11/21/1998,39.6283333,-84.1594444
77007,2010-09-22 22:10:00,depoe bay,or,USA,fireball,600.0,10 minutes,three fast moving orange lights moving south to north along the Oregon Coast&#44 then faded away.,11/21/2010,44.8086111,-124.0619444
20763,2011-12-26 00:00:00,junction city,ks,USA,diamond,180.0,3:00,Big red lights flying low,1/12/2012,39.0286111,-96.8311111
47343,1983-06-01 16:00:00,dearborn,mi,USA,disk,1200.0,20 minutes,Saucer with multi-colored lights near Fairlane Mall in Dearborn,12/7/2006,42.3222222,-83.1763889
1239,1996-10-13 20:00:00,encino,ca,USA,triangle,3.0,3 seconds,very large V shaped craft flys from horizon to horizon in 3 seconds&#44 very low and silent (Los Angeles),2/1/2007,34.1591667,-118.5002778
19250,1999-12-20 04:00:00,browns valley/marysville (near beale air force base),ca,Other,disk,1800.0,30 minutes +-,object appears to remain stationary 20-30 minutes&#44 has many greenish-blue flashing lights some rapidly moving white lghts. No noise. So,1/7/2000,39.214712,-121.481844
45459,1998-05-04 00:45:00,memphis,tn,USA,unknown,60.0,1 minute,Between 4-6 dim&#44 orange lights&#44 traveling NNW-SSE. Straight line travel&#44 no noise.,1/28/1999,35.1494444,-90.0488889
37572,2005-04-18 11:00:00,arizona (rural; buck eye salome rd.),az,Other,sphere,15.0,10-15 sec,the spheres moved in unison and seem to follow the leader,5/11/2005,34.048928,-111.093731
47576,1994-06-01 21:30:00,las vegas,nv,USA,triangle,480.0,8 minutes,Black triangle seen in 1994 over Las Vegas. 911 called.,11/11/2013,36.175,-115.1363889
43384,2005-05-20 03:00:00,fergus falls,mn,USA,triangle,300.0,5 minutes,I observed a bright orange triangle that made no noise and moved slowly into the North disappearing.,5/24/2005,46.2830556,-96.0772222
74978,2012-09-15 02:15:00,medford,or,USA,other,1800.0,30 minutes,UFO Landing in Medford&#44 OR.,9/24/2012,42.3266667,-122.8744444
54382,2013-06-08 22:00:00,clinton township,mi,Other,light,1200.0,20 minutes,String of Orange lights acending the sky.,7/3/2013,42.586888,-82.919551
78382,1999-09-29 15:25:00,olathe,ks,USA,sphere,60.0,1 minute,Traveling W to pick up son from school.  Saw extraordinarily bright orb slowly traveling N in straight line. Size was about diameter of,10/2/1999,38.8813889,-94.8188889
41496,1964-05-01 22:00:00,orangevale,ca,USA,light,300.0,five minutes,Chased by a single light - Sacramento&#44 CA 1964,6/18/2004,38.6786111,-121.2247222
37142,2000-04-16 14:00:00,san diego,ca,USA,cylinder,2100.0,35 minutes,Cylinder object&#44 sighted on Naval Medical Center spys on music festival for all to see.,4/8/2002,32.7152778,-117.1563889
8102,1974-11-01 21:00:00,oil city,pa,USA,unknown,7200.0,1-2 hours,Bright lights in the sky seperated by several miles moving in odd geometric directions--changing course instantly,4/16/2005,41.4338889,-79.7066667
76650,2006-09-02 16:00:00,cranbrook (canada),bc,Canada,oval,300.0,5 minutes,Oval shaped object with white moving objects adjacent,10/31/2008,49.516667,-115.766667
17090,2000-12-11 06:24:00,alexandria,ky,USA,diamond,30.0,around 30 seconds,My father and I were leaving on our way to take me to shool. When my father stopped&#44 pulled to the side of the road and pointed to a fo,4/28/2001,38.9594444,-84.3880556
79229,2011-09-04 22:30:00,columbia,mo,USA,sphere,300.0,5 minutes,Fifty silent spherical craft moving quickly over Columbia Missouri,10/10/2011,38.9516667,-92.3338889
18054,1997-12-14 06:45:00,auburn,in,USA,sphere,120.0,2 minutes,We saw 3 unexplained&#44 white orbs of light hovering over a church we were driving to.  We saw them from our car&#44 and they hovered over t,1/28/1999,41.3669444,-85.0588889
79902,2000-09-08 12:30:00,new york city,ny,USA,rectangle,960.0,16 mins,New York City - 9/8/2000,9/17/2000,40.7141667,-74.0063889
74508,2013-09-14 22:45:00,fayetteville,ga,USA,light,300.0,~5 minutes,Five bright white lights moving E to W at constant speed and altitude with no similarities to aircraft.,12/2/2013,33.4486111,-84.455
6640,1996-10-06 22:00:00,fire island (long island),ny,USA,other,2700.0,45 minutes,Fire Island up close encounter with a UFO.,4/27/2004,40.6475,-73.1463889
26232,2004-02-13 20:00:00,why/tracy,az,Other,formation,15.0,half hour,My sons and I observed four bright&#44 winking lights in the sky in a diagonal fashion in southern Arizona.,4/27/2004,34.048928,-111.093731
59513,2011-07-24 01:00:00,oxnard,ca,USA,triangle,3600.0,1 hour,UFO with red&#44 white and green lights in a triangle form hovering over the ocean.  ((NUFORC Note:  Possible twinkling star.  PD)),8/7/2011,34.1975,-119.1761111
31722,2008-03-15 21:30:00,wadesboro,nc,USA,formation,120.0,2 minutes,7 Red lights in a straight line they were there no noise no movement and were gone,7/5/2008,34.9680556,-80.0769444
16587,2012-11-09 22:00:00,radford,va,USA,flash,1800.0,30 minutes,Saw two flashing lights&#44 blue-green light fell from sky. Moving slow&#44 many helicopers following.,11/19/2012,37.1316667,-80.5766667
29026,2011-02-28 17:02:00,round rock,tx,USA,other,61.0,61 seconds,At 17:02 on 2/28/2011 a object appear in the east sky almost over head&#44 sun was at my back&#44 object was moving from north to south&#44 goin,3/10/2011,30.5080556,-97.6786111
44228,1997-05-25 01:10:00,skies over sierra nevada,ca,Other,light,600.0,10 minutes,several very fast greenish/blue pulses of light along the Eastern side of California or possibly in Nevada,6/3/2003,39.134667,-121.171039
54643,1995-07-10 21:50:00,bonanza,or,USA,,60.0,60 sec.,Woman witnesses four very bright yellow lights appear&#44 then disappear sequentially.  (Note: Was military  flares over local airport.),11/2/1999,42.1988889,-121.405
55583,2011-07-01 21:45:00,belton,mo,USA,cross,45.0,45 seconds,A bright cross shaped&#44 fire colored with diamond shaped aura flew straigh nort directly over head of me heading towards k.c.&#44 mo.,7/4/2011,38.8119444,-94.5316667
29695,2013-02-06 21:50:00,plainfield,il,USA,circle,300.0,5 minutes,Two balls of fire hovering in the sky over Plainfield&#44 Illinois.,2/18/2013,41.6269444,-88.2038889
48533,2012-06-14 20:00:00,pawleys island,sc,USA,circle,30.0,30 seconds,Three bright red lights in sky over the ocean at Pawley&#39s Island&#44 SC,6/20/2012,33.4330556,-79.1216667
14973,2008-01-15 09:10:00,highland,ca,USA,sphere,3.0,3 seconds,Silver sphere hovers above old Norton AFB&#44 maneuvers quickly and stops.,1/21/2008,34.1283333,-117.2077778
48073,2003-06-12 21:30:00,rancho cucamonga,ca,USA,rectangle,180.0,3 min.,We observed a bright orange object moving across the sky slowly form horizon to horizon.,9/24/2003,34.1063889,-117.5922222
1199,2013-10-12 20:20:00,morganton,nc,USA,light,300.0,5 minutes,Red/orange lights.,11/11/2013,35.7452778,-81.685
67149,1999-08-17 21:00:00,westfield,nj,USA,circle,3.0,three seconds,I was on my hammock with my 19 mos. old son -- I was trying to rock him to sleep when I saw a small circular pinpoint -- green in hue -,8/30/1999,40.6588889,-74.3477778
39118,2014-04-25 21:30:00,morgantown,wv,USA,other,900.0,15 minutes,Observed 12-18 flickering&#44 yellowish-burning objects following a path NW to SE above Morgantown&#44 WV.,5/2/2014,39.6294444,-79.9561111
12653,2013-11-23 11:51:00,sandpoint,id,USA,triangle,30.0,30 seconds,Heading Southeast on Hwy 2 from Priest River&#44 Id to Sandpoint&#44 Id at Wrenco Loop Road. Low flying projectile&#44 mirror-like reflective su,12/2/2013,48.2766667,-116.5522222
23558,2007-12-08 00:19:00,olathe,ks,USA,light,900.0,15 minutes,K and C were driving down the street after receiving a phone call from a friend about a strange light appearing above his house. K and,3/4/2008,38.8813889,-94.8188889
74287,1996-09-14 20:00:00,battle mountain,nv,USA,disk,300.0,5 miutes,Full moon or just after (that time) 8 to 8-30 pm. Two seperate occasions&#44 the first a month earlier. Disc shaped&#44 no lights&#44 featureles,11/1/1998,40.6422222,-116.9333333
59058,2009-07-22 02:40:00,hamburg,mi,USA,other,120.0,2 minutes,Single Electric Blue gumdrop shaped object appeared with a flash and appeared to land.,7/28/2010,42.4486111,-83.8016667
44092,1996-05-24 23:05:00,bowie,md,USA,,3.0,3 sec.,FAA empl.&#44 several adults see very bright disc &quot;w/ a dark hole in the middle.&quot;  2x diam. of moon. Obj. hovered&#44 suddenly disappeared.,11/2/1999,39.0066667,-76.7794444
492,1961-10-01 22:00:00,graham,nc,USA,triangle,30.0,30 seconds,3 flat&#44 large  white lights in delta pattern&#44 no sound&#44 flying at tree-top level at 35-40 mph,5/14/2002,36.0688889,-79.4008333
16591,2012-11-09 23:15:00,lewiston,me,USA,light,300.0,5 minutes,White light moving across sky that stopped and stayed still.,11/19/2012,44.1002778,-70.2152778
58548,2002-07-21 20:31:00,gilbert,az,USA,fireball,120.0,2 minutes,a shooting star but whiter object flew over our heads and started blinking with blue lights all over it,8/16/2002,33.3527778,-111.7883333
28319,2014-02-23 21:55:00,temple city,ca,USA,diamond,300.0,5 minutes,Ten diamond shape objects floating in the sky.,2/27/2014,34.1072222,-118.0569444
13198,1999-11-27 04:30:00,weldon,ca,USA,cross,3600.0,60 min.,A bright shaft of light shaped like a huge check mark from west to east was seen coming up behind the mountains&#44 behind which there is,12/16/1999,35.6658333,-118.2894444
74605,1978-09-15 21:00:00,braceville,oh,USA,diamond,900.0,15min.,It was over 28yrs. ago now&#44  and I can remember it like yesterday.,2/14/2006,41.2283333,-80.9547222
9423,2000-11-15 07:00:00,cambridge,md,USA,light,120.0,2 minutes,A bright orb like craft flying low over Maryland.,8/5/2001,38.5630556,-76.0791667
22138,2014-01-23 07:40:00,walnut creek/concord,ca,Other,unknown,60.0,60 seconds,Three irregular shapes flying in close proximity in Walnut Creek&#44 Ca.,1/30/2014,37.941299,-122.048773
16837,2013-01-20 23:00:00,mar del plata (argentina),,Other,light,60.0,1 minute,Oval bright white light&#44 traveling fast for about a minute&#44 then disappearing.,2/4/2013,-37.979858,-57.589794
60488,2012-07-28 21:40:00,dayton,oh,USA,sphere,900.0,15 minutes,Yellowish/orange spheres seen by 4 people in Dayton&#44 Ohio.,8/5/2012,39.7588889,-84.1916667
55183,1973-07-01 21:00:00,macon,ga,USA,disk,60.0,under 1 minute,GEORGIA UFO GROUP/MUFON (joint post)-Debriefing of Witness-Probable Wave of 1973,8/24/2004,32.8405556,-83.6325
24730,2005-01-05 20:00:00,los angeles,ca,USA,fireball,10.0,10 secs,I saw a  green fireball travelling across the night sky towards earth.,1/11/2005,34.0522222,-118.2427778
14441,2006-11-04 21:20:00,bloomington,ca,USA,light,3.0,3 seconds,While driving home in Bloomington&#44 we turned westbound on Jurupa from Locust Ave.  I noticed a green light in the sky directly in front,12/7/2006,34.0702778,-117.395
62500,2012-07-04 22:00:00,lee&#39s summit,mo,Other,changing,480.0,7-8 minutes,Four lights hover in sky&#44 followed by fireballs circulating the night sky.,8/5/2012,38.910841,-94.382172
66799,2011-08-15 00:00:00,hunt,ny,USA,triangle,1800.0,25-30 minutes,Triangle lights blinking&#44 then slowly rotating&#44 then blinking again. Then it took off at an unimaginable speed.,12/12/2013,42.5469444,-77.9944444
58017,2002-07-19 23:30:00,toronto (canada),on,Canada,circle,15.0,15 seconds,2 sightings on the same night one hour apart,8/16/2002,43.666667,-79.416667
60454,2011-07-28 10:30:00,beatty,nv,USA,flash,120.0,120 seconds,Intense bright flashing light cluster possible diamond or triangle giant craft over Nye county Nevada,8/7/2011,36.9086111,-116.7583333
60446,2010-07-28 22:00:00,chico,ca,USA,triangle,240.0,4 min,Triangle shaped formation of lights slowed and stopped&#44 then changed direction and flew off.,8/24/2010,39.7286111,-121.8363889
38851,2008-04-24 06:05:00,melbourne,fl,USA,light,180.0,2-3 minuets,Pre dawn with clear moon lite sky&#44 three bright lights appeared quickly and vanished just as quick&#44 but all were of the same appearanc,6/12/2008,28.0833333,-80.6083333
25657,2014-02-10 21:30:00,christchurch (uk/england),,Britain,other,172800.0,2 days,((HOAX??)) UFO&#39s activity over two days caught on still image camera (not man made craft checked all databases).,2/21/2014,51.6,-2.95
61995,2009-07-04 21:30:00,snohomish,wa,USA,light,120.0,2 minute,Bright orange light hovered right over our house with no noise.,8/5/2009,47.9130556,-122.0969444
3558,2012-10-21 14:40:00,lawrenceville,ga,USA,changing,1200.0,20 minutes,Reflective object over Lawrenceville Ga. 10/21/12,10/30/2012,33.9561111,-83.9880556
13781,2000-11-30 16:00:00,vancouver (canada),bc,Canada,fireball,10.0,10 seconds,Spinning ball of fire that disappeared &#44 and army helicoters going by.,12/9/2000,49.25,-123.133333
18976,2006-12-19 20:40:00,ridgecrest,ca,USA,fireball,300.0,5 mins,Ball of fire was dancing around in the sky above Ridgecrest&#44 Ca at exactly 8:40 p.m.,2/1/2007,35.6225,-117.67
33829,1996-03-28 19:40:00,greendale,in,USA,rectangle,10.0,app. 10 sec.,We saw a transparent U,3/2/2004,39.1125,-84.8641667
25127,2011-01-07 07:30:00,vista,ca,USA,egg,240.0,4 min,Zig sagged light in sky,8/7/2011,33.2,-117.2416667
9931,2004-11-16 11:00:00,tombstone to saguaro nat park,az,Other,other,1800.0,30 mins,a balloon/fish shaped object hovering above the mountains  ((NUFORC Note:  Possible INS or Customs balloon.  PD)),12/14/2004,34.048928,-111.093731
17697,2004-12-12 20:25:00,dallas,tx,USA,formation,10.0,5-10 seconds,Two linear groups of maneuvering lights over Dallas&#44 Texas 12/12/04,1/19/2005,32.7833333,-96.8
61653,1997-07-04 21:30:00,crestwood (near st. louis),mo,USA,light,20.0,15-20 seconds,My wife and I were on our deck watching the fireworks display at Webster Groves Recreation Center&#44 about a mile from our location. A br,9/26/1998,38.5569444,-90.3816667
3172,2000-10-20 23:30:00,greenville,nc,USA,changing,3000.0,50 min,On that night my mother-in-law so it first&#44then her husband.Then she came over and got my self and my wife.We went out side and looked,12/2/2000,35.6125,-77.3666667
14515,2010-11-04 00:00:00,billings-lockwood,mt,Other,disk,120.0,2 min,It was metalic in color&#44 with 4 bright spot lights&#44 in a cross shape with a bright red light in the center&#44 it was just hoovering.,11/21/2010,45.80391,-108.446927
27119,2009-02-17 00:00:00,new orleans,la,USA,teardrop,1227.0,20:27,Photographing a party on the rooftop of a hotel in New Orleans and captured these objects in seven of my photos.,4/3/2011,29.9544444,-90.075
23844,2006-12-09 20:33:00,saint paul,mn,USA,chevron,120.0,2 minuets,UFO in Minnesota&#44 witnessed by three people.,12/14/2006,44.9444444,-93.0930556
17756,2009-12-12 04:00:00,oklahoma city,ok,USA,other,60.0,60 sec,Craft with lights but no sound,2/14/2010,35.4675,-97.5161111
63494,2004-07-07 22:00:00,salem,or,USA,light,180.0,2-3 minutes,Strange lights -- moving and not moving -- seen in skys over Salem&#44 OR,7/25/2004,44.9430556,-123.0338889
64761,1962-08-01 19:30:00,beaverton,or,USA,triangle,120.0,2 minutes,Daytime approach and stopped within short distance and was extremely visible.,7/14/2013,45.4872222,-122.8025
41931,2010-05-12 00:00:00,hull (hull) (uk/england),,Britain,other,60.0,1 min,Hull england  Lights 1-2 Mins cluster of lights (Around 10-15),6/3/2010,53.716667,-0.333333
71293,1986-08-04 00:00:00,harrisonburg,la,USA,,300.0,5 min.,Woman repts. witnessing dramatic disturbance in local reservoir caused by large &quot;falling&quot; object.  Other witnesses in LA&#44 NC (?).,11/2/1999,31.7719444,-91.8213889
36178,2009-04-01 20:30:00,gainesville,fl,USA,changing,45.0,45 seconds,One fiery ball that grew into a crescent shape&#44 then an apparent battle between 2 jets and a small craft.,12/12/2009,29.6513889,-82.325
78030,2007-09-27 14:30:00,carrollton,tx,USA,light,360.0,6minutes,Bright pin point light moving extremely slow at High Altitude,10/8/2007,32.9536111,-96.89
18606,2012-12-16 22:30:00,winter park,fl,USA,fireball,600.0,5 to 10 minutes,Fireball ufo flies south to north and stops.,12/20/2012,28.5997222,-81.3394444
38023,2012-04-20 21:00:00,danbury,nh,USA,unknown,30.0,30  seconds,I saw something in the sky that was not a plane&#44meteor&#44or satelite,5/13/2012,43.5255556,-71.8622222
53495,2006-06-04 21:30:00,crystal lake,il,USA,changing,180.0,3mins,UFO Sighting in Crystal Lake,7/16/2006,42.2411111,-88.3161111
34926,1997-03-06 01:00:00,rohnert park (sonoma state university),ca,USA,sphere,10800.0,three(3) hours +,I 1st noticed 3 small objects/stars/points &quot;excited state&quot;&#44 were Iscoceles  their locations from each other.  One then vanished&#44 two re,3/7/1998,38.3397222,-122.7
32298,1996-03-19 20:30:00,texas highway 54 heading into nm - after crossing i-10,tx,Other,other,180.0,2-3 minutes,Typo in fist report...1996...First saw bright non-stationary object in the sky&#44 then felt the head from this &quot;hot star&quot; on the left sid,7/14/1999,40.147952,-88.968399
17402,2003-12-01 19:30:00,stevens point,wi,USA,light,600.0,10 minutes or more,Goldish orange light in the southeast sky.,12/9/2003,44.5236111,-89.5744444
